Pathway,MM1,MM2,MM3,MM4,MV1,MV2,MV3,UM1,UM2,UM3,UM4,UM5
PWY-7440: dTDP-&beta;-L-4-epi-vancosamine biosynthesis,100,100,100,98,100,99,98,100,100,100,100,100
PWY-7456: mannan degradation,0,0,0,0,0,0,0,0,0,0,0,0
PWY-7476: superpathway avenacin A biosynthesis,0,0,0,0,0,0,0,0,0,0,0,0
"PWY-7480: 2,3-dihydroxybenzoate degradation",0,0,0,3,0,0,1,0,0,0,0,0
PWY-7490: patulin biosynthesis,0,0,0,0,0,0,0,0,0,0,0,0
PWY-7510: rhizocticin A and B biosynthesis,0,0,0,0,0,0,0,0,0,0,0,0
PWY-7517: brassicicene C biosynthesis,0,39,51,18,0,51,59,24,19,33,73,45
PWY-7523: L-arginine degradation XII,0,0,0,0,0,0,0,0,0,0,0,0
PWY-7527: L-methionine salvage cycle III,0,0,0,0,0,0,0,0,0,0,0,0
PWY-7528: L-methionine salvage cycle I (bacteria and plants),0,0,0,0,0,0,0,0,0,0,0,0
PWY-7533: gliotoxin biosynthesis,0,0,0,0,0,0,0,0,0,0,0,0
PWY-7539: 6-hydroxymethyl-dihydropterin diphosphate biosynthesis III (Chlamydia),0,0,0,0,0,0,0,0,0,0,0,0
PWY-7555: &alpha;-cyclopiazonate biosynthesis,100,100,100,99,100,100,100,100,100,100,100,100
PWY-7557: dehydrodiconiferyl alcohol degradation,100,100,99,99,100,100,98,100,100,100,100,100
PWY-7560: methylerythritol phosphate pathway II,99,99,81,84,98,94,87,97,92,99,98,99
PWY-7571: ferrichrome A biosynthesis,0,0,0,0,0,0,0,0,0,0,0,0
PWY-7574: propanoyl-CoA degradation II,0,0,0,0,0,0,0,0,0,0,0,0
PWY-7575: superpathway of candicidin biosynthesis,0,0,0,0,0,0,0,0,0,0,0,0
PWY-7579: phycourobilin biosynthesis,0,0,0,0,0,0,0,0,0,0,0,0
PWY-7592: arachidonate biosynthesis III (metazoa),0,0,0,0,0,0,0,0,0,0,0,0
PWY-7596: superpathway of stearidonate biosynthesis (cyanobacteria),0,0,0,0,0,0,0,0,0,0,0,0
PWY-7601: arachidonate biosynthesis IV (8-detaturase),0,0,0,0,0,0,0,0,0,0,0,0
PWY-7602: icosapentaenoate biosynthesis V (&Delta;8 desaturase),0,0,0,0,0,0,0,0,0,0,0,0
PWY-7606: docosahexaenoate biosynthesis III (mammals),0,0,0,0,0,0,0,0,0,0,0,0
PWY-7616: methanol oxidation to carbon dioxide,0,0,0,0,0,0,0,0,0,0,0,0
PWY-7619: juniperonate biosynthesis,0,0,0,0,0,0,0,0,0,0,0,0
PWY-7636: astaxanthin biosynthesis (flowering plants),0,0,0,0,0,0,0,0,0,0,0,0
"PWY-7654: (8E,10E)-dodeca-8,10-dienol biosynthesis",0,0,0,0,0,0,0,0,0,0,0,0
PWY-7656: Spodoptera littoralis pheromone biosynthesis,0,0,0,0,0,0,0,0,0,0,0,0
PWY-7657: dTDP-&beta;-L-digitoxose biosynthesis,100,100,99,97,100,99,96,100,100,100,100,100
PWY-7659: viridicatumtoxin biosynthesis,62,61,68,33,69,66,73,65,35,60,73,74
PWY-7663: gondoate biosynthesis (anaerobic),100,100,100,100,100,100,98,100,100,100,100,100
PWY-7664: oleate biosynthesis IV (anaerobic),0,0,17,32,0,61,0,0,0,0,0,0
PWY-821: superpathway of sulfur amino acid biosynthesis (Saccharomyces cerevisiae),0,0,0,1,0,0,0,0,0,0,0,0
PWY-841: superpathway of purine nucleotides de novo biosynthesis I,37,22,24,37,1,29,9,14,1,7,36,24
PWY-922: mevalonate pathway I,0,0,0,0,0,0,0,0,0,0,0,0
PWY0-1061: superpathway of L-alanine biosynthesis,0,0,0,0,0,0,0,0,0,0,0,0
PWY0-1241: ADP-L-glycero-&beta;-D-manno-heptose biosynthesis,0,0,0,0,0,0,0,0,0,0,0,0
PWY0-1261: anhydromuropeptides recycling,0,0,0,0,0,0,0,0,0,0,0,0
PWY0-1277: 3-phenylpropanoate and 3-(3-hydroxyphenyl)propanoate degradation,0,0,0,0,0,0,0,0,0,0,0,0
PWY0-1296: purine ribonucleosides degradation,7,3,0,43,0,9,28,2,0,2,0,0
PWY0-1297: superpathway of purine deoxyribonucleosides degradation,10,5,0,46,1,14,22,2,0,3,0,0
PWY0-1298: superpathway of pyrimidine deoxyribonucleosides degradation,0,0,0,0,0,0,0,0,0,0,0,0
PWY0-1319: CDP-diacylglycerol biosynthesis II,0,0,0,0,0,0,0,0,0,0,0,0
PWY0-1338: polymyxin resistance,0,0,0,0,0,0,0,0,0,0,0,0
PWY0-1415: superpathway of heme biosynthesis from uroporphyrinogen-III,0,0,0,0,0,0,0,0,0,0,0,0
PWY0-1479: tRNA processing,0,0,0,0,0,0,0,0,0,0,0,0
PWY0-1586: peptidoglycan maturation (meso-diaminopimelate containing),0,0,0,6,0,0,1,0,0,0,0,0
PWY0-162: superpathway of pyrimidine ribonucleotides de novo biosynthesis,38,35,78,16,72,88,70,57,2,30,49,50
PWY0-166: superpathway of pyrimidine deoxyribonucleotides de novo biosynthesis (E. coli),100,100,96,99,100,100,99,100,100,100,100,100
"PWY0-301: L-ascorbate degradation I (bacterial, anaerobic)",0,0,0,0,0,0,0,0,0,0,0,0
PWY0-321: phenylacetate degradation I (aerobic),0,0,0,0,0,0,0,0,0,0,0,0
PWY0-41: allantoin degradation IV (anaerobic),0,0,0,0,0,0,0,0,0,0,0,0
PWY0-42: 2-methylcitrate cycle I,0,0,0,0,0,0,0,0,0,0,0,0
PWY0-781: aspartate superpathway,0,0,0,1,0,0,0,0,0,0,0,0
PWY0-845: superpathway of pyridoxal 5'-phosphate biosynthesis and salvage,0,0,0,0,0,0,0,0,0,0,0,0
PWY0-862: (5Z)-dodec-5-enoate biosynthesis,0,0,8,17,0,40,0,0,0,0,0,0
PWY0-881: superpathway of fatty acid biosynthesis I (E. coli),0,0,0,0,0,0,0,0,0,0,0,0
PWY1F-823: leucopelargonidin and leucocyanidin biosynthesis,0,0,0,0,0,0,0,0,0,0,0,0
PWY1F-FLAVSYN: flavonoid biosynthesis,0,0,0,0,0,0,0,0,0,0,0,0
PWY1G-0: mycothiol biosynthesis,0,0,0,0,0,0,0,0,0,0,0,0
PWY3DJ-35471: L-ascorbate biosynthesis IV,0,0,0,0,0,0,0,0,0,0,0,0
PWY3O-1109: superpathway of 4-hydroxybenzoate biosynthesis (yeast),0,0,0,0,0,0,0,0,0,0,0,0
PWY3O-19: ubiquinol-6 biosynthesis from 4-hydroxybenzoate (eukaryotic),0,0,0,0,0,0,0,0,0,0,0,0
PWY3O-355: stearate biosynthesis III (fungi),0,0,0,0,0,0,0,0,0,0,0,0
PWY490-3: nitrate reduction VI (assimilatory),0,0,0,0,0,0,0,0,0,0,0,0
PWY4FS-3: phosphatidylcholine biosynthesis III,0,0,0,0,0,0,0,0,0,0,0,0
PWY4FS-4: phosphatidylcholine biosynthesis IV,0,0,0,0,0,0,0,0,0,0,0,0
PWY4FS-5: superpathway of phosphatidylcholine biosynthesis,0,0,0,0,0,0,0,0,0,0,0,0
PWY4FS-6: phosphatidylethanolamine biosynthesis II,0,0,0,0,0,0,0,0,0,0,0,0
PWY4FS-7: phosphatidylglycerol biosynthesis I (plastidic),0,0,0,0,0,0,0,0,0,0,0,0
PWY4FS-8: phosphatidylglycerol biosynthesis II (non-plastidic),0,0,0,0,0,0,0,0,0,0,0,0
PWY4LZ-257: superpathway of fermentation (Chlamydomonas reinhardtii),0,0,0,0,0,0,0,0,0,0,0,0
PWY5F9-12: biphenyl degradation,0,0,0,0,0,0,0,0,0,0,0,0
PWY66-201: nicotine degradation IV,0,0,0,0,0,0,0,0,0,0,0,0
PWY66-367: ketogenesis,0,0,0,0,0,0,0,0,0,0,0,0
PWY66-373: sucrose degradation V (sucrose &alpha;-glucosidase),0,0,0,0,0,0,0,0,0,0,0,0
PWY66-374: C20 prostanoid biosynthesis,0,0,0,0,0,0,0,0,0,0,0,0
PWY66-375: leukotriene biosynthesis,0,0,0,0,0,0,0,0,0,0,0,0
PWY66-378: androgen biosynthesis,0,0,0,0,0,0,0,0,0,0,0,0
PWY66-387: fatty acid &alpha;-oxidation II,100,93,90,49,98,81,72,30,96,54,94,79
PWY66-388: fatty acid &alpha;-oxidation III,0,0,0,0,0,0,86,0,0,0,0,0
PWY66-389: phytol degradation,0,0,0,0,0,0,0,0,0,0,0,0
PWY66-391: fatty acid &beta;-oxidation VI (peroxisome),0,0,0,0,0,0,0,0,0,0,0,0
PWY66-398: TCA cycle III (animals),85,91,89,80,96,68,69,87,86,95,96,89
PWY66-399: gluconeogenesis III,99,99,98,95,100,95,93,100,100,99,100,100
PWY66-400: glycolysis VI (metazoan),0,0,0,0,0,0,0,0,0,0,0,0
PWY66-409: superpathway of purine nucleotide salvage,0,0,0,5,0,0,0,0,0,0,0,0
PWY66-422: D-galactose degradation V (Leloir pathway),0,0,0,0,0,0,0,0,0,0,0,0
PWY66-425: L-lysine degradation II (L-pipecolate pathway),0,0,0,0,0,0,0,0,0,0,0,0
PWY6666-2: dopamine degradation,0,0,0,0,0,0,0,0,0,0,0,0
PWYG-321: mycolate biosynthesis,100,100,100,100,100,100,98,100,100,100,100,100
PWYQT-4472: glucosinolate biosynthesis from trihomomethionine,0,0,0,0,0,0,0,0,0,0,0,0
PWYQT-4473: glucosinolate biosynthesis from tetrahomomethionine,0,0,0,0,0,0,0,0,0,0,0,0
PWYQT-4474: glucosinolate biosynthesis from pentahomomethionine,0,0,0,0,0,0,0,0,0,0,0,0
PWYQT-4475: glucosinolate biosynthesis from hexahomomethionine,0,0,0,0,0,0,0,0,0,0,0,0
PYRIDNUCSAL-PWY: NAD salvage pathway I,0,0,0,0,0,0,0,0,0,0,0,0
PYRIDNUCSYN-PWY: NAD biosynthesis I (from aspartate),4,1,10,31,15,9,37,7,1,4,0,0
PYRIDOXSYN-PWY: pyridoxal 5'-phosphate biosynthesis I,0,0,0,3,0,0,4,0,0,0,0,0
REDCITCYC: TCA cycle VIII (helicobacter),0,0,0,0,0,0,0,0,0,0,0,0
RHAMCAT-PWY: L-rhamnose degradation I,0,0,0,0,0,0,0,0,0,0,0,0
RIBOSYN2-PWY: flavin biosynthesis I (bacteria and plants),0,0,1,2,0,0,5,0,0,0,0,0
RUMP-PWY: formaldehyde oxidation I,0,0,0,0,0,0,0,0,0,0,0,0
SALVADEHYPOX-PWY: adenosine nucleotides degradation II,43,47,35,46,76,29,22,59,52,58,31,54
SER-GLYSYN-PWY: superpathway of L-serine and glycine biosynthesis I,9,16,34,77,2,0,32,13,7,1,38,2
SO4ASSIM-PWY: sulfate reduction I (assimilatory),0,0,0,8,0,0,2,0,0,0,0,0
SPHINGOLIPID-SYN-PWY: sphingolipid biosynthesis (yeast),0,0,0,0,0,0,0,0,0,0,0,0
SUCROSEUTIL2-PWY: sucrose degradation VII (sucrose 3-dehydrogenase),1,3,3,25,1,1,0,0,0,0,0,0
SUCSYN-PWY: sucrose biosynthesis I (from photosynthesis),0,0,0,0,0,0,0,0,0,0,0,0
SULFATE-CYS-PWY: superpathway of sulfate assimilation and cysteine biosynthesis,0,0,1,15,0,0,5,0,0,0,0,0
TCA-GLYOX-BYPASS: superpathway of glyoxylate bypass and TCA,0,0,0,8,0,0,0,0,0,0,0,0
TCA: TCA cycle I (prokaryotic),100,100,100,99,100,100,100,100,100,100,100,100
TEICHOICACID-PWY: teichoic acid (poly-glycerol) biosynthesis,0,0,0,0,0,0,0,0,0,0,0,0
THISYN-PWY: superpathway of thiamin diphosphate biosynthesis I,0,0,0,0,0,0,0,0,0,0,0,0
THISYNARA-PWY: superpathway of thiamin diphosphate biosynthesis III (eukaryotes),0,0,0,0,0,0,1,0,0,0,0,0
THREOCAT-PWY: superpathway of L-threonine metabolism,0,0,0,0,0,0,0,0,0,0,0,0
THRESYN-PWY: superpathway of L-threonine biosynthesis,95,93,66,72,93,85,79,94,89,88,92,90
TRIGLSYN-PWY: diacylglycerol and triacylglycerol biosynthesis,0,0,0,0,0,0,0,0,0,0,0,0
TRNA-CHARGING-PWY: tRNA charging,100,100,100,99,100,100,99,100,100,100,100,100
TRPSYN-PWY: L-tryptophan biosynthesis,0,0,0,0,0,0,0,0,0,0,0,0
TRYPTOPHAN-DEGRADATION-1: L-tryptophan degradation III (eukaryotic),0,0,0,0,0,0,0,0,0,0,0,0
TYRFUMCAT-PWY: L-tyrosine degradation I,0,0,0,3,0,0,0,0,0,0,0,0
UBISYN-PWY: superpathway of ubiquinol-8 biosynthesis (prokaryotic),0,0,0,0,0,0,0,0,0,0,0,0
UDPNACETYLGALSYN-PWY: UDP-N-acetyl-D-glucosamine biosynthesis II,0,0,0,0,0,0,0,0,0,0,0,0
UDPNAGSYN-PWY: UDP-N-acetyl-D-glucosamine biosynthesis I,100,100,97,99,100,99,98,100,100,100,100,100
URDEGR-PWY: superpathway of allantoin degradation in plants,0,0,0,0,0,0,0,0,0,0,0,0
URSIN-PWY: ureide biosynthesis,0,0,0,0,0,0,0,0,0,0,0,0
VALDEG-PWY: L-valine degradation I,0,0,0,0,0,0,0,0,0,0,0,0
VALSYN-PWY: L-valine biosynthesis,100,100,100,100,100,100,100,100,100,100,100,100
ERGOSTEROL-SYN-PWY: superpathway of ergosterol biosynthesis I,0,0,0,0,0,0,0,0,0,0,0,0
PWY-2083: isoflavonoid biosynthesis II,0,0,0,0,0,0,0,0,0,0,0,0
PWY-5507: adenosylcobalamin biosynthesis I (early cobalt insertion),0,0,0,0,0,0,0,0,0,0,0,0
PWY-5679: clavulanate biosynthesis,0,0,0,0,0,0,0,0,0,0,0,0
PWY-6074: zymosterol biosynthesis,0,0,0,0,0,0,0,0,0,0,0,0
PWY-6143: CMP-pseudaminate biosynthesis,0,0,0,0,0,0,0,0,0,0,0,0
PWY-6148: tetrahydromethanopterin biosynthesis,0,0,0,0,0,0,0,0,0,0,0,0
PWY-6344: L-ornithine degradation II (Stickland reaction),0,0,0,0,0,0,0,0,0,0,0,0
"PWY-6358: superpathway of D-myo-inositol (1,4,5)-trisphosphate metabolism",0,0,0,0,0,0,0,0,0,0,0,0
PWY-6470: peptidoglycan biosynthesis V (&beta;-lactam resistance),0,0,0,0,0,0,0,0,0,0,0,0
PWY-6915: pentalenolactone biosynthesis,0,0,0,0,0,0,0,0,0,0,0,0
PWY-7128: nicotine degradation III (VPP pathway),0,0,0,0,0,0,0,0,0,0,0,0
PWY-7156: superpathway of ergosterol biosynthesis II,0,0,0,0,0,0,0,0,0,0,0,0
PWY-7224: purine deoxyribonucleosides salvage,0,0,0,0,0,0,0,0,0,0,0,0
"PWY-7377: cob(II)yrinate a,c-diamide biosynthesis I (early cobalt insertion)",0,0,0,0,0,0,0,0,0,0,0,0
PWY-7426: mannosyl-glycoprotein N-acetylglucosaminyltransferases,0,0,0,0,0,0,0,0,0,0,0,0
PWY-7436: vitamin E biosynthesis (tocotrienols),0,0,0,0,0,0,0,0,0,0,0,0
PWY-7446: sulfoglycolysis,0,0,0,0,0,0,0,0,0,0,0,0
PWY-882: L-ascorbate biosynthesis I (L-galactose pathway),0,0,0,0,0,0,0,0,0,0,0,0
PWY66-341: cholesterol biosynthesis I,0,0,0,0,0,0,0,0,0,0,0,0
PWY66-382: mineralocorticoid biosynthesis,0,0,0,0,0,0,0,0,0,0,0,0
PWY66-4: cholesterol biosynthesis III (via desmosterol),0,0,0,0,0,0,0,0,0,0,0,0
PWY-6558: heparan sulfate biosynthesis (late stages),0,0,0,0,0,0,0,0,0,0,0,0
PWY66-301: catecholamine biosynthesis,0,0,0,0,0,0,0,0,0,0,0,0
PWY-7119: sphingolipid recycling and degradation (yeast),0,0,0,0,0,0,0,0,0,0,0,0
PWY-2229: superpathway of pterocarpan biosynthesis (via formononetin),0,0,0,0,0,0,0,0,0,0,0,0
PWY-3581: (S)-reticuline biosynthesis I,0,0,0,0,0,0,0,0,0,0,0,0
PWY-5292: vindoline and vinblastine biosynthesis,0,0,0,0,0,0,0,0,0,0,0,0
PWY-5301: ajmaline and sarpagine biosynthesis,0,0,0,0,0,0,0,0,0,0,0,0
PWY-5717: superpathway of formononetin derivative biosynthesis,0,0,0,0,0,0,0,0,0,0,0,0
"PWY-6365: D-myo-inositol (3,4,5,6)-tetrakisphosphate biosynthesis",0,0,0,0,0,0,0,0,0,0,0,0
PWY-7283: wybutosine biosynthesis,0,0,0,0,0,0,0,0,0,0,0,0
PWY-7305: superpathway of steroid hormone biosynthesis,0,0,0,0,0,0,0,0,0,0,0,0
PWY-7352: daunorubicin biosynthesis,0,0,0,0,0,0,0,0,0,0,0,0
PWY-7485: tetracenomycin C biosynthesis,0,0,0,0,0,0,0,0,0,0,0,0
PWY-5381: pyridine nucleotide cycling (plants),0,0,0,0,0,0,0,0,0,0,0,0
PWY-6577: farnesylcysteine salvage pathway,0,0,0,0,0,0,0,0,0,0,0,0
ECASYN-PWY: enterobacterial common antigen biosynthesis,0,0,0,0,0,0,0,0,0,0,0,0
P181-PWY: nicotine degradation I (pyridine pathway),0,0,0,0,0,0,0,0,0,0,0,0
PWY-6167: flavin biosynthesis II (archaea),0,0,0,0,0,0,0,0,0,0,0,0
PWY-6244: bergamotene biosynthesis II,0,0,0,0,0,0,0,0,0,0,0,0
PWY-6797: 6-hydroxymethyl-dihydropterin diphosphate biosynthesis II (archaea),0,0,0,0,0,0,0,0,0,0,0,0
PWY-7102: bisabolene biosynthesis,0,0,0,0,0,0,0,0,0,0,0,0
PWY-7287: novobiocin biosynthesis,0,0,0,0,0,0,0,0,0,0,0,0
LPSSYN-PWY: superpathway of lipopolysaccharide biosynthesis,0,0,0,0,0,0,0,0,0,0,0,0
PWY-3061: menthol biosynthesis,0,0,0,0,0,0,0,0,0,0,0,0
PWY-5098: chlorophyll a degradation I,0,0,0,0,0,0,0,0,0,0,0,0
"PWY-5434: (3E)-4,8-dimethylnona-1,3,7-triene biosynthesis",0,0,0,0,0,0,0,0,0,0,0,0
PWY-5733: germacrene biosynthesis,0,0,0,0,0,0,0,0,0,0,0,0
"PWY66-3: cholesterol biosynthesis II (via 24,25-dihydrolanosterol)",0,0,0,0,0,0,0,0,0,0,0,0
PWY66-5: superpathway of cholesterol biosynthesis,0,0,0,0,0,0,0,0,0,0,0,0
PWY-2681: trans-zeatin biosynthesis,0,0,0,0,0,0,0,0,0,0,0,0
"PWY-5954: (1'S,5'S)-averufin biosynthesis",0,0,0,0,0,0,0,0,0,0,0,0
P341-PWY: glycolysis V (Pyrococcus),0,0,0,0,0,0,0,0,0,0,0,0
PWY-3301: sinapate ester biosynthesis,0,0,0,0,0,0,0,0,0,0,0,0
PWY-6142: gluconeogenesis II (Methanobacterium thermoautotrophicum),0,0,0,0,0,0,0,0,0,0,0,0
PWY-7106: erythromycin D biosynthesis,0,0,0,0,0,0,0,0,0,0,0,0
# Pathway,0,0,0,0,0,0,0,0,0,0,0,0
"12DICHLORETHDEG-PWY: 1,2-dichloroethane degradation|unclassified",0,0,0,0,0,0,0,0,0,0,0,0
1CMET2-PWY: N10-formyl-tetrahydrofolate biosynthesis|unclassified,0,0,0,0,0,0,0,0,0,0,0,90
2ASDEG-PWY: orthanilate degradation|unclassified,0,0,0,0,0,0,0,0,0,0,0,0
3-HYDROXYPHENYLACETATE-DEGRADATION-PWY: 4-hydroxyphenylacetate degradation|unclassified,0,0,0,0,0,0,0,0,0,0,0,0
4-HYDROXYMANDELATE-DEGRADATION-PWY: 4-hydroxymandelate degradation|unclassified,0,0,0,0,0,0,0,0,0,0,0,0
4TOLCARBDEG-PWY: 4-toluenecarboxylate degradation|unclassified,0,0,0,0,0,0,0,0,0,0,0,0
"7ALPHADEHYDROX-PWY: cholate degradation (bacteria, anaerobic)|unclassified",0,0,0,0,0,0,0,0,0,0,0,0
ALL-CHORISMATE-PWY: superpathway of chorismate metabolism|unclassified,0,0,0,0,0,0,0,0,0,0,0,0
ALLANTOINDEG-PWY: superpathway of allantoin degradation in yeast|unclassified,0,0,0,0,0,0,0,0,0,0,0,0
ANAEROFRUCAT-PWY: homolactic fermentation|unclassified,0,0,0,0,0,0,0,0,0,0,0,98
ANAGLYCOLYSIS-PWY: glycolysis III (from glucose)|unclassified,0,0,0,0,0,0,0,0,0,0,0,97
ARG+POLYAMINE-SYN: superpathway of arginine and polyamine biosynthesis|unclassified,0,0,0,0,0,0,0,0,0,0,0,0
"ARGDEG-PWY: superpathway of L-arginine, putrescine, and 4-aminobutanoate degradation|unclassified",0,0,0,0,0,0,0,0,0,0,0,0
ARGININE-SYN4-PWY: L-ornithine de novo  biosynthesis|unclassified,0,0,0,0,0,0,0,0,0,0,0,36
"ARGORNPROST-PWY: arginine, ornithine and proline interconversion|unclassified",0,0,0,0,0,0,0,0,0,0,0,0
ARGSYN-PWY: L-arginine biosynthesis I (via L-ornithine)|unclassified,0,0,0,0,0,0,0,0,0,0,0,0
ARGSYNBSUB-PWY: L-arginine biosynthesis II (acetyl cycle)|unclassified,0,0,0,0,0,0,0,0,0,0,0,100
ARO-PWY: chorismate biosynthesis I|unclassified,0,0,0,0,0,0,0,0,0,0,0,100
ASPASN-PWY: superpathway of L-aspartate and L-asparagine biosynthesis|unclassified,0,0,0,0,0,0,0,0,0,0,0,0
AST-PWY: L-arginine degradation II (AST pathway)|unclassified,0,0,0,0,0,0,0,0,0,0,0,0
BIOTIN-BIOSYNTHESIS-PWY: biotin biosynthesis I|unclassified,0,0,0,0,0,0,0,0,0,0,0,0
BRANCHED-CHAIN-AA-SYN-PWY: superpathway of branched amino acid biosynthesis|unclassified,0,0,0,0,0,0,0,0,0,0,0,100
CALVIN-PWY: Calvin-Benson-Bassham cycle|unclassified,0,0,0,0,0,0,0,0,0,0,0,100
CARNMET-PWY: L-carnitine degradation I|unclassified,0,0,0,0,0,0,0,0,0,0,0,0
CATECHOL-ORTHO-CLEAVAGE-PWY: catechol degradation to &beta;-ketoadipate|unclassified,0,0,0,0,0,0,0,0,0,0,0,0
CENTFERM-PWY: pyruvate fermentation to butanoate|unclassified,0,0,0,0,0,0,0,0,0,0,0,0
"CHLOROPHYLL-SYN: chlorophyllide a biosynthesis I (aerobic, light-dependent)|unclassified",0,0,0,0,0,0,0,0,0,0,0,0
CITRULBIO-PWY: L-citrulline biosynthesis|unclassified,0,0,0,0,0,0,0,0,0,0,0,31
COA-PWY-1: coenzyme A biosynthesis II (mammalian)|unclassified,0,0,0,0,0,0,0,0,0,0,0,0
COA-PWY: coenzyme A biosynthesis I|unclassified,0,0,0,0,0,0,0,0,0,0,0,0
COBALSYN-PWY: adenosylcobalamin salvage from cobinamide I|unclassified,0,0,0,0,0,0,0,0,0,0,0,0
CODH-PWY: reductive acetyl coenzyme A pathway|unclassified,0,0,0,0,0,0,0,0,0,0,0,100
COLANSYN-PWY: colanic acid building blocks biosynthesis|unclassified,0,0,0,0,0,0,0,0,0,0,0,0
COMPLETE-ARO-PWY: superpathway of aromatic amino acid biosynthesis|unclassified,0,0,0,0,0,0,0,0,0,0,0,100
CRNFORCAT-PWY: creatinine degradation I|unclassified,0,0,0,0,0,0,0,0,0,0,0,0
DAPLYSINESYN-PWY: L-lysine biosynthesis I|unclassified,0,0,0,0,0,0,0,0,0,0,0,61
DENOVOPURINE2-PWY: superpathway of purine nucleotides de novo biosynthesis II|unclassified,0,0,0,0,0,0,0,0,0,0,0,0
DTDPRHAMSYN-PWY: dTDP-L-rhamnose biosynthesis I|unclassified,0,0,0,0,0,0,0,0,0,0,0,0
ENTBACSYN-PWY: enterobactin biosynthesis|unclassified,0,0,0,0,0,0,0,0,0,0,0,0
FAO-PWY: fatty acid &beta;-oxidation I|unclassified,0,0,0,0,0,0,0,0,0,0,0,100
FASYN-ELONG-PWY: fatty acid elongation -- saturated|unclassified,0,0,0,0,0,0,0,0,0,0,0,100
FERMENTATION-PWY: mixed acid fermentation|unclassified,0,0,0,0,0,0,0,0,0,0,0,2
FOLSYN-PWY: superpathway of tetrahydrofolate biosynthesis and salvage|unclassified,0,0,0,0,0,0,0,0,0,0,0,0
FUC-RHAMCAT-PWY: superpathway of fucose and rhamnose degradation|unclassified,0,0,0,0,0,0,0,0,0,0,0,0
FUCCAT-PWY: fucose degradation|unclassified,0,0,0,0,0,0,0,0,0,0,0,0
GALACT-GLUCUROCAT-PWY: superpathway of hexuronide and hexuronate degradation|unclassified,0,0,0,0,0,0,0,0,0,0,0,0
GALACTARDEG-PWY: D-galactarate degradation I|unclassified,0,0,0,0,0,0,0,0,0,0,0,0
GALACTUROCAT-PWY: D-galacturonate degradation I|unclassified,0,0,0,0,0,0,0,0,0,0,0,0
GALLATE-DEGRADATION-I-PWY: gallate degradation II|unclassified,0,0,0,0,0,0,0,0,0,0,0,0
GALLATE-DEGRADATION-II-PWY: gallate degradation I|unclassified,0,0,0,0,0,0,0,0,0,0,0,0
GAMMAHEXCHLORDEG-PWY: &gamma;-hexachlorocyclohexane degradation|unclassified,0,0,0,0,0,0,0,0,0,0,0,0
"GLCMANNANAUT-PWY: superpathway of N-acetylglucosamine, N-acetylmannosamine and N-acetylneuraminate degradation|unclassified",0,0,0,0,0,0,0,0,0,0,0,0
GLUCARDEG-PWY: D-glucarate degradation I|unclassified,0,0,0,0,0,0,0,0,0,0,0,0
GLUCARGALACTSUPER-PWY: superpathway of D-glucarate and D-galactarate degradation|unclassified,0,0,0,0,0,0,0,0,0,0,0,0
GLUCONEO-PWY: gluconeogenesis I|unclassified,0,0,0,0,0,0,0,0,0,0,0,99
GLUCOSE1PMETAB-PWY: glucose and glucose-1-phosphate degradation|unclassified,0,0,0,0,0,0,0,0,0,0,0,0
GLUCUROCAT-PWY: superpathway of &beta;-D-glucuronide and D-glucuronate degradation|unclassified,0,0,0,0,0,0,0,0,0,0,0,0
GLUDEG-I-PWY: GABA shunt|unclassified,0,0,0,0,0,0,0,0,0,0,0,0
GLUDEG-II-PWY: L-glutamate degradation VII (to butanoate)|unclassified,0,0,0,0,0,0,0,0,0,0,0,0
GLUTORN-PWY: L-ornithine biosynthesis|unclassified,0,0,0,0,0,0,0,0,0,0,0,0
GLYCOCAT-PWY: glycogen degradation I (bacterial)|unclassified,0,0,0,0,0,0,0,0,0,0,0,0
GLYCOGENSYNTH-PWY: glycogen biosynthesis I (from ADP-D-Glucose)|unclassified,0,0,0,0,0,0,0,0,0,0,0,0
GLYCOLYSIS-E-D: superpathway of glycolysis and Entner-Doudoroff|unclassified,0,0,0,0,0,0,0,0,0,0,0,0
"GLYCOLYSIS-TCA-GLYOX-BYPASS: superpathway of glycolysis, pyruvate dehydrogenase, TCA, and glyoxylate bypass|unclassified",0,0,0,0,0,0,0,0,0,0,0,0
GLYCOLYSIS: glycolysis I (from glucose 6-phosphate)|unclassified,0,0,0,0,0,0,0,0,0,0,0,100
GLYOXYLATE-BYPASS: glyoxylate cycle|unclassified,0,0,0,0,0,0,0,0,0,0,0,42
"GOLPDLCAT-PWY: superpathway of glycerol degradation to 1,3-propanediol|unclassified",0,0,0,0,0,0,0,0,0,0,0,0
HCAMHPDEG-PWY: 3-phenylpropanoate and 3-(3-hydroxyphenyl)propanoate degradation to 2-oxopent-4-enoate|unclassified,0,0,0,0,0,0,0,0,0,0,0,0
HEME-BIOSYNTHESIS-II: heme biosynthesis I (aerobic)|unclassified,0,0,0,0,0,0,0,0,0,0,0,0
HEMESYN2-PWY: heme biosynthesis II (anaerobic)|unclassified,0,0,0,0,0,0,0,0,0,0,0,0
HEXITOLDEGSUPER-PWY: superpathway of hexitol degradation (bacteria)|unclassified,0,0,0,0,0,0,0,0,0,0,0,0
HISDEG-PWY: L-histidine degradation I|unclassified,0,0,0,0,0,0,0,0,0,0,0,0
HISHP-PWY: L-histidine degradation VI|unclassified,0,0,0,0,0,0,0,0,0,0,0,94
HISTSYN-PWY: L-histidine biosynthesis|unclassified,0,0,0,0,0,0,0,0,0,0,0,0
HOMOSER-METSYN-PWY: L-methionine biosynthesis I|unclassified,0,0,0,0,0,0,0,0,0,0,0,0
HSERMETANA-PWY: L-methionine biosynthesis III|unclassified,0,0,0,0,0,0,0,0,0,0,0,87
ILEUDEG-PWY: L-isoleucine degradation I|unclassified,0,0,0,0,0,0,0,0,0,0,0,0
ILEUSYN-PWY: L-isoleucine biosynthesis I (from threonine)|unclassified,0,0,0,0,0,0,0,0,0,0,0,100
KDO-NAGLIPASYN-PWY: superpathway of (Kdo)2-lipid A biosynthesis|unclassified,0,0,0,0,0,0,0,0,0,0,0,0
KETOGLUCONMET-PWY: ketogluconate metabolism|unclassified,0,0,0,0,0,0,0,0,0,0,0,0
LACTOSECAT-PWY: lactose and galactose degradation I|unclassified,0,0,0,0,0,0,0,0,0,0,0,0
LEU-DEG2-PWY: L-leucine degradation I|unclassified,0,0,0,0,0,0,0,0,0,0,0,0
LIPASYN-PWY: phospholipases|unclassified,0,0,0,0,0,0,0,0,0,0,0,0
LPSSYN-PWY: superpathway of lipopolysaccharide biosynthesis|unclassified,0,0,0,0,0,0,0,0,0,0,0,0
LYSDEGII-PWY: L-lysine degradation III|unclassified,0,0,0,0,0,0,0,0,0,0,0,0
LYSINE-AMINOAD-PWY: L-lysine biosynthesis IV|unclassified,0,0,0,0,0,0,0,0,0,0,0,0
LYSINE-DEG1-PWY: L-lysine degradation XI (mammalian)|unclassified,0,0,0,0,0,0,0,0,0,0,0,0
"MANNOSYL-CHITO-DOLICHOL-BIOSYNTHESIS: protein N-glycosylation (eukaryotic, high mannose)|unclassified",0,0,0,0,0,0,0,0,0,0,0,0
MET-SAM-PWY: superpathway of S-adenosyl-L-methionine biosynthesis|unclassified,0,0,0,0,0,0,0,0,0,0,0,0
METH-ACETATE-PWY: methanogenesis from acetate|unclassified,0,0,0,0,0,0,0,0,0,0,0,0
METHANOGENESIS-PWY: methanogenesis from H2 and CO2|unclassified,0,0,0,0,0,0,0,0,0,0,0,0
METHGLYUT-PWY: superpathway of methylglyoxal degradation|unclassified,0,0,0,0,0,0,0,0,0,0,0,0
METHYLGALLATE-DEGRADATION-PWY: methylgallate degradation|unclassified,0,0,0,0,0,0,0,0,0,0,0,0
METSYN-PWY: L-homoserine and L-methionine biosynthesis|unclassified,0,0,0,0,0,0,0,0,0,0,0,0
NAD-BIOSYNTHESIS-II: NAD salvage pathway II|unclassified,0,0,0,0,0,0,0,0,0,0,0,0
NADSYN-PWY: NAD biosynthesis II (from tryptophan)|unclassified,0,0,0,0,0,0,0,0,0,0,0,0
NAGLIPASYN-PWY: lipid IVA biosynthesis|unclassified,0,0,0,0,0,0,0,0,0,0,0,0
NONMEVIPP-PWY: methylerythritol phosphate pathway I|unclassified,0,0,0,0,0,0,0,0,0,0,0,100
NONOXIPENT-PWY: pentose phosphate pathway (non-oxidative branch)|unclassified,0,0,0,0,0,0,0,0,0,0,0,100
NPGLUCAT-PWY: Entner-Doudoroff pathway II (non-phosphorylative)|unclassified,0,0,0,0,0,0,0,0,0,0,0,0
OANTIGEN-PWY: O-antigen building blocks biosynthesis (E. coli)|unclassified,0,0,0,0,0,0,0,0,0,0,0,0
ORNARGDEG-PWY: superpathway of L-arginine and L-ornithine degradation|unclassified,0,0,0,0,0,0,0,0,0,0,0,0
ORNDEG-PWY: superpathway of ornithine degradation|unclassified,0,0,0,0,0,0,0,0,0,0,0,0
P105-PWY: TCA cycle IV (2-oxoglutarate decarboxylase)|unclassified,0,0,0,0,0,0,0,0,0,0,0,65
P108-PWY: pyruvate fermentation to propanoate I|unclassified,0,0,0,0,0,0,0,0,0,0,0,0
P122-PWY: heterolactic fermentation|unclassified,0,0,0,0,0,0,0,0,0,0,0,0
P124-PWY: Bifidobacterium shunt|unclassified,0,0,0,0,0,0,0,0,0,0,0,0
"P125-PWY: superpathway of (R,R)-butanediol biosynthesis|unclassified",0,0,0,0,0,0,0,0,0,0,0,0
P161-PWY: acetylene degradation|unclassified,0,0,0,0,0,0,0,0,0,0,0,0
P162-PWY: L-glutamate degradation V (via hydroxyglutarate)|unclassified,0,0,0,0,0,0,0,0,0,0,0,0
P163-PWY: L-lysine fermentation to acetate and butanoate|unclassified,0,0,0,0,0,0,0,0,0,0,0,0
P164-PWY: purine nucleobases degradation I (anaerobic)|unclassified,0,0,0,0,0,0,0,0,0,0,0,0
P165-PWY: superpathway of purines degradation in plants|unclassified,0,0,0,0,0,0,0,0,0,0,0,0
P184-PWY: protocatechuate degradation I (meta-cleavage pathway)|unclassified,0,0,0,0,0,0,0,0,0,0,0,0
P185-PWY: formaldehyde assimilation III (dihydroxyacetone cycle)|unclassified,0,0,0,0,0,0,0,0,0,0,0,0
P221-PWY: octane oxidation|unclassified,0,0,0,0,0,0,0,0,0,0,0,0
P23-PWY: reductive TCA cycle I|unclassified,0,0,0,0,0,0,0,0,0,0,0,0
P241-PWY: coenzyme B biosynthesis|unclassified,0,0,0,0,0,0,0,0,0,0,0,0
P261-PWY: coenzyme M biosynthesis I|unclassified,0,0,0,0,0,0,0,0,0,0,0,0
P3-PWY: gallate degradation III (anaerobic)|unclassified,0,0,0,0,0,0,0,0,0,0,0,0
P381-PWY: adenosylcobalamin biosynthesis II (late cobalt incorporation)|unclassified,0,0,0,0,0,0,0,0,0,0,0,0
"P4-PWY: superpathway of L-lysine, L-threonine and L-methionine biosynthesis I|unclassified",0,0,0,0,0,0,0,0,0,0,0,0
P41-PWY: pyruvate fermentation to acetate and lactate I|unclassified,0,0,0,0,0,0,0,0,0,0,0,100
P42-PWY: incomplete reductive TCA cycle|unclassified,0,0,0,0,0,0,0,0,0,0,0,0
